{
  "metadata": {
    "project_id": "Project_001",
    "agent": "parser",
    "task_id": "task-2a9c",
    "timestamp": "2026-07-22T09:30:00+08:00",
    "schema_version": "1.0",
    "status": "COMPLETED",
    "quality": { "confidence": 0.88, "quality_score": 84, "validation_passed": true }
  },
  "units": { "length": "mm", "area": "m2", "angle": "degree" },
  "coordinates": { "origin": [0, 0], "system": "world" },
  "walls": [
    { "id": "W01", "start": [0, 0], "end": [5000, 0], "thickness": 200 },
    { "id": "W02", "start": [5000, 0], "end": [5000, 4000], "thickness": 200 },
    { "id": "W03", "start": [5000, 4000], "end": [0, 4000], "thickness": 200 },
    { "id": "W04", "start": [0, 4000], "end": [0, 0], "thickness": 200 }
  ],
  "doors": [
    { "id": "D01", "position": [2500, 0], "width": 900, "rotation": 0 }
  ],
  "windows": [
    { "id": "WIN01", "position": [1000, 4000], "width": 1800 }
  ],
  "rooms": [
    {
      "room_id": "R001",
      "name": "客厅",
      "type": "LIVING",
      "boundary": [[0, 0], [5000, 0], [5000, 4000], [0, 4000]],
      "area": 20.0,
      "floor_level": 0
    }
  ]
}
