{
  "metadata": {
    "project_id": "demo_empty",
    "agent": "parser",
    "task_id": "parser-demo_empty",
    "timestamp": "2026-07-23T10:29:30.830445+08:00",
    "schema_version": "1.0",
    "status": "COMPLETED",
    "quality": {
      "confidence": 0.3,
      "quality_score": 30,
      "validation_passed": true
    }
  },
  "units": {
    "length": "mm",
    "area": "m2",
    "angle": "degree"
  },
  "coordinates": {
    "origin": [
      0,
      0
    ],
    "system": "world"
  },
  "walls": [],
  "doors": [],
  "windows": [],
  "rooms": []
}